{
  "contract": "sys2qa.analysis-request",
  "schema_version": "1.0.0",
  "request_id": "areq:2026-10-22-001",
  "system_id": "system:acme-portal",
  "base_package": {
    "package_id": "pkg:acme-portal",
    "package_version": 3
  },
  "revision": {
    "kind": "git_commit",
    "value": "4b775e0c2a9d1f3e5b7c9d0e1f2a3b4c5d6e7f80",
    "worktree_dirty": false
  },
  "environment_id": null,
  "subject_ids": ["business_rule:registration.nib_required_13_digits", "gap:nib-length-docs-mismatch"],
  "question": "Is a 16-digit NIB accepted by any code path (client or server)?",
  "trigger": {
    "type": "test_failure",
    "ref": "arun:01JBQC00000000000000000000/case:TC-REG-004"
  },
  "budget": {
    "max_files": 200,
    "max_minutes": 10,
    "max_llm_tokens": 50000
  },
  "max_permission_level": "L1",
  "requested_by": "user:local",
  "created_at": "2026-10-22T03:10:00Z"
}
